{
  "lexicon": { "name": "report", "version": 1 },
  "counts": { "error": 1, "warn": 1, "info": 1 },
  "files": 2,
  "diagnostics": [
    {
      "engine": "plumb",
      "ruleId": "plumb/no-raw-html-layout",
      "severity": "error",
      "message": "raw <div> outside a primitive",
      "help": "Render a Card primitive instead.",
      "docsUrl": "https://autotelic.dev/plumb/no-raw-html-layout",
      "identity": "plumb/plumb/no-raw-html-layout:src/routes/settings_.tsx:div",
      "fixable": true,
      "location": {
        "file": "src/routes/settings_.tsx",
        "line": 12,
        "column": 5,
        "endLine": 12,
        "endColumn": 10
      }
    },
    {
      "engine": "joggle",
      "ruleId": "joggle/layer-direction",
      "severity": "warn",
      "message": "a primitive imports a shared component",
      "identity": "joggle/joggle/layer-direction:src/components/ui/badge.tsx",
      "location": { "file": "src/components/ui/badge.tsx", "line": 3, "column": 1 }
    },
    {
      "engine": "joggle",
      "ruleId": "joggle/unparsed-output",
      "severity": "info",
      "message": "an engine could not run",
      "location": { "file": "joggle.config", "line": 1, "column": 1 }
    }
  ],
  "generators": [
    { "id": "plumb", "diagnostics": 1, "error": 1, "warn": 0, "info": 0 },
    { "id": "joggle", "diagnostics": 2, "error": 0, "warn": 1, "info": 1 }
  ]
}
