{
  "protocolVersion": "0.1.0",
  "counts": { "error": 0, "warn": 0, "info": 1 },
  "files": 1,
  "diagnostics": [
    {
      "engine": "joggle",
      "ruleId": "joggle/unparsed-output",
      "severity": "info",
      "message": "jig could not parse joggle output (exit 1)",
      "location": { "file": "joggle.config", "line": 1, "column": 1 }
    }
  ],
  "generators": [{ "id": "joggle", "diagnostics": 1, "error": 0, "warn": 0, "info": 1 }]
}
